{
  "schema_version": "0.1.0",
  "display_mode": "text_debug",
  "session_id": "demo-warning",
  "scenario_id": "smoke_inhalation_room_v0",
  "phase": "scene_assessed",
  "validation_status": "warning",
  "status_line": "scene_assessed / warning / 1 warning(s)",
  "warnings": [
    "visibility_cue_not_checked: The smoke/visibility cue has not been checked in this POC scenario."
  ],
  "errors": [],
  "objects": [
    {
      "object_id": "wooden_chair_poc",
      "label": "Wooden chair",
      "display": "moved aside",
      "blocks_path": false,
      "alert_level": "normal",
      "metadata": {
        "location": "clear_of_entry_path",
        "physics_enabled": false
      }
    },
    {
      "object_id": "entry_door_poc",
      "label": "Entry door",
      "display": "open",
      "blocks_path": false,
      "alert_level": "normal",
      "metadata": {
        "locked": false,
        "door_type": "hinged_wooden_door_preview"
      }
    },
    {
      "object_id": "smoke_visibility_cue_poc",
      "label": "Smoke/visibility cue",
      "display": "unchecked",
      "blocks_path": false,
      "alert_level": "attention",
      "metadata": {
        "visibility_level": "low",
        "physics_enabled": false
      }
    }
  ]
}
